Unique_ID,Body_Text
ROF-147,"Shift 4 (You may pay 4 {i} to play this on top of one of your characters named Gaston.)
Developed Brain: When you play this character, look at the top 3 cards of your deck. You may put one into your hand. Put the rest on the bottom of your deck in any order."
ROF-148,"Ancient Insight: Whenever you remove 1 or more damage from one of your characters, gain 2 lore."
ROF-149,"Artificer: When you play this character and whenever he quests, you may banish one of your items to draw 2 cards."
ROF-150,"Never, Ever Lose Sight: When this character is banished, you may put this card into your inkwell facedown and exerted."
ROF-151,"I'm A Fast Learner: When you play this character, remove up to 1 damage from chosen character of yours."
ROF-152,"Don't Call Me Cute: When you play this character, you may banish chosen item. Its player draws a card."
ROF-153,"Tidy Up: Whenever you play a Floodborn character, you may put the top card of your deck into your inkwell facedown and exerted."
ROF-154,"It's Called A Hustle: When play this character, you may return an item card name Pawpsicle from your discard to your hand."
ROF-155,"Hide And Seek: While you have an item in play, this character gains Resist +1 and Ward. (Damage dealt to this character is reduced by 1. Opponents can't choose this character except to challenge.)"
ROF-156,NA
ROF-157,NA
ROF-158,NA
ROF-159,"I Trust You: Whenever this character quests, look at the top 2 cards of your deck. You may put one into your hand. Put the rest on the bottom of your deck in any order."
ROF-160,Ward (Opponents can't choose this character except to challenge.)
ROF-161,"Hunny Pot: Whenever this character quests, you may put a card from your hand into your inkwell facedown."
ROF-171,"You're Not Welcome Here: When you play this character, you may deal 1 damage to chosen character."
ROF-172,"Shield Another: Whenever one of your other character would be dealt damage, put that many damage counters on this character instead."
ROF-173,"Shift 3 (You may pay 3 {i} to play this on top of one of your characters named Beast.)
It's Better This Way: At the start of your turn, if this character has no damage, draw a card. Otherwise, he gets +4 {s} this turn."
ROF-174,"We Have A Choice: When you play this character, you may banish chosen item."
ROF-175,"Insubordination!: Whenever you play a Floodborn character, deal 1 damage to each opposing character."
ROF-176,"Have Courage: When you play this character, you may draw a card, then choose and discard a card."
ROF-177,"Shift 5 (You may pay 5 {i} to play this on top of one of your characters named Cinderella.) Resist +2 (Damage dealt to this character is reduced by 2.) The Singing Sword: Whenever you play a song, this character may challenge ready characters this turn."
ROF-178,NA
ROF-179,NA
ROF-180,NA
ROF-181,Shift 4 (You may pay 4 {i} to play this on top of one of your characters named Hercules.)\nResist +2 (Damage dealth to this character is reduced by 2.)
ROF-182,NA
ROF-183,"Shift 2 (You may pay 2 {i} to play this on top of one of your characters named Jafar.)\nNow Where Were We?: During your turn, whenever this character banishes another character in a challenge, you may draw a card."
ROF-184,"I Don't Trust Him, Sire: During your turn, this character gains Evasive. (They can challenge characters with Evasive.)"
ROF-185,"Resist +1 (Damage dealt to this character is reduced by 1.)\nScout Leader: During your turn, whenever this character banishes another character in a challenge, you may deal 2 damage to chosen character."
ROF-186,"Payback: While this character has no damage, he gets +4 {s}."
ROF-187,"Archery Lesson: Whenever this character quests, your characters gain Evasive this turn. (They can challenge characters with Evasive.)"
ROF-188,"Make It Shine: When you play this character, chosen character gains Resist +1 until the start of your next turn. (Damage dealt to them is reduced by 1.)"
ROF-189,Bodyguard (This character may enter play exerted. An opposing character who challenges one of your characters must choose one with Bodyguard if able.)\nBlades: This character can challenge ready characters.
ROF-190,NA
ROF-191,NA
ROF-192,"Off With Their Heads!: Whenever an opposing character is banished, you may ready this character."
ROF-193,Skirmish {e} - Deal 1 damage to chosen character.
ROF-194,"Change Of Heart: Whenever this character quests, you may draw a card, then choose and discard a card."
ROF-195,Bodyguard (This character may enter play exerted. An opposing character who challenges one of your characters must choose one with Bodyguard if able.)\nResist +1 (Damage dealt to this character is reduced by 1.)
ROF-196,"Resist +2 (Damage dealt to this character is reduced by 2.)\nWhat You Give Is What You Get: While this character is exerted and you have no cards in your hand, opponents can't play actions."
ROF-197,NA
SSK-001,"Tell Everybody: During opponents' turns, you can't lost lore."
SSK-002,NA
SSK-003,"Singer 6 (This-character counts as cost6 {i} to sing songs.) It's Beautiful, No?: When you play this character, you may play a song with cost 6 or less for free."
SSK-004,"Support (Whenever this character quests, you
may add their {s} to another chosen character's {s}
this turn.)"
SSK-005,"Brothers Forever: While this character is exerted, your characters named Koda can't be challenged."
SSK-006,NA
SSK-007,NA
SSK-008,"Support (Whenever this character quests, you
may add their {s} to another chosen character's
{s} this turn.)"
SSK-009,"You've Got To Pay To Play:Whenever this character quests, chosen opposing character gets -1{s} until the start of your next turn."
SSK-010,"Bodyguard (This character may enter play exerted.
An opposing character who challenges one of
your characters must choose one with Bodyguard
if able.)"
SSK-011,"Singer 5 (This character counts as cost 5 to sing
songs.)"
SSK-012,"Shift 3 (You may pay 3{i} to play this on top of one of your characters named Fix-lt Felix, Jr.) Building Together: Your locations get +2 {w}."
SSK-013,"Bodyguard (This character may enter play exerted. An opposing character who challenges one of your characters must choose one with Bodyguard if able.)  Song Of The Herd: For each song card in your discard, you pay 1{i} less to play this character."
SSK-014,"Not Without My Family: You can't play this character unless you have 5 or more characters in play."
SSK-015,"Shift 4 (You may pay 4{i}  to play this on top of one of your characters named Minnie Mouse.) Parade Order: When you play this character, if you used Shift to play her, you may search your deck for a character card and reveal that card to all players. Shuffle your deck and put that card on top of it."
SSK-016,"Big Prize: Whenever this character quests, each opponent reveals the top card of their deck. If it's a character card, they may put it into their hand. Otherwise, they put it on the bottom of their deck."
SSK-017,"Oh, My Land!: When you play this character, if you have a location in play, draw a card."
SSK-018,NA
SSK-019,"Shift 2 (You may pay 2{i} to play this on top of one of
your characters named Vanellope von Schweetz.)
I HEREBY DECREE: Whenever you play another
Princess character, all opposing characters get -1{s}
until the start of your next turn."
SSK-020,"Fan Favorite: Whenever you play a song, gain 1 lore."
SSK-021,"I've Got The Coolest Friend: When you play  this character, return a character card from your discard to your hand. If that card is a Princess character card, gain 2 lore."
SSK-022,"If It Pleases The Lady: When you play this
character, chosen opposing character gets -5 {s}
until the start of your next turn."
SSK-023,"Reindeer Games: When you play this character, you may ready chosen character. They can't quest or challenge for the rest of this turn."
SSK-024,"Patch Them Up: Whenever this character quests,
you may remove up to 2 damage from chosen
character."
SSK-035,"Shift 6 (You may pay 6{i} to play this on top of one of
your characters named Maleficent.)
Listen Well, All Of You: When you play this character,
for each of your characters named Maleficent in play,
return a chosen opposing character, item, or location
with cost 3 or less to their player's hand."
SSK-036,"Turning Tides: When you play this character,
you may move up to 2 damage counters from
chosen character to chosen opposing character."
SSK-037,"Move It!: When you play this character,
chosen character gains Rush this turn. (They can
challenge the turn they're played.)"
SSK-038,"Give Me Time To Think: When you play this
character and when he leaves play, look at the
top 2 cards of your deck. Put one on the top of
your deck and the other on the bottom."
SSK-039,"Evasive (Only characters with Evasive can
challenge this character.)"
SSK-040,"Evasive (Only characters with Evasive can
challenge this character.)
Parting Gift: When this character is banished,
you may draw a card."
SSK-041,"Unearthed: When you play this character, each
opponent draws a card."
SSK-042,"Recurring Gust: When this character is
banished in a challenge, return this card to your
hand."
SSK-043,NA
SSK-044,"A Little Game: When you play this character, banish
her or return another chosen character of yours to your
hand.
Sneaky Move: At the start of your turn, you may move
up to 2 damage counters from this character to chosen
opposing character."
SSK-045,NA
SSK-046,"Shift 4 (You may pay 4{i} to play this on top of
one of your characters named Anna.)
Exceptional Power: When you play this
character, exert all opposing characters."
SSK-047,"Shift 3 (You may pay 3{i} to play this on top of one of your
characters named Archimedes.)
Evasive (Only characters with Evasive can challenge this
character.)
Challenger +3 (While challenging, this character gets +3{s}.)"
SSK-048,"Rush (This character can challenge the turn they're played.)
Evasive (Only characters with Evasive can challenge this
character.)
Crystallize: When you play this character, exert chosen
opposing character."
SSK-049,"Phenomenal Showman: While this character is
exerted, opposing characters can't ready at the
start of their turn."
SSK-050,"Clear The Path: For each exerted character
opponents have in play, you pay 1{i} less to
play this character.
Evasive (Only characters with Evasive can
challenge this character.)"
SSK-051,"What An Awkward Situation: Whenever this
character quests, you may choose and discard a
card to return chosen character, item, or location
with cost 3 or less to their player's hand."
SSK-052,NA
SSK-053,"Playing With Power: During opponents' turns,
if an effect would cause you to discard one or
more cards from your hand, you don't discard."
SSK-054,NA
SSK-055,"Rush (This character con challenge the turn
they're played.)
Surprising Skill: When you play this character,
he gains Challenger +4 this turn. (They get +4
while challenging.)"
SSK-056,"Growing Powers: When you play this character,
each opponent chooses and exerts one of their
ready characters."
SSK-057,"Pleasing The Queen: {e} - Chosen exerted
character can't ready at the start of their next
turn."
SSK-058,"Imitate: Whenever this character quests, you
may gain lore equal to the {l} of chosen other
character of yours. Return that character to your
hand."
SSK-069,"Tag Me In!: For each 1 damage on opposing characters, you pay 1{i} less to play this character.
Ward (Opponents can't choose this character except to challenge.)"
SSK-070,"Evasive (Only characters with Evasive can challenge this character.)
Easy Pickings: While challenging a damaged character, this character gets +2{s}."
SSK-071,NA
SSK-072,"Evasive (Only characters with Evasive can
challenge this character.)"
SSK-073,Silent Performance: This character can't {e} to sing songs.
SSK-074,"Cause A Panic: When you play this character, you may deal 2 damage to chosen damaged character."
SSK-075,"Fiddle Faddle: While being challenged, this character gets +2{s}."
SSK-076,"Ray Of Hope: When you play this character, you
may pay 1{i} to give chosen character +2 {s} this
turn."
SSK-077,"Trick Shot: When you play this character, if an
opponent has a damaged character in play, gain 1
lore."
SSK-078,NA
SSK-079,"Evasive (Only characters with Evasive can
challenge this character.)
In Disguise: Whenever this character quests,
you pay 2{i} less for the next action you play this
turn."
SSK-080,NA
SSK-081,"Rowdy Guest: Damaged characters can't
challenge this character."
SSK-082,"Evasive (Only characters with Evasive can
challenge this character.)
Do Say Hello To Mr. Arrow: When you play this character, you may pay 3{i} to banish chosen
damaged character."
SSK-083,"Slayer Of Dragons: When you play this character,
banish chosen opposing Dragon character.
Pressing The Advantage: Whenever he challenges
a damaged character, ready this character after the
challenge."
SSK-084,"Shift 5 (You may pay 5{i} to play this on top of one
of your characters named Clarabelle.)
Keep In Step: At the end of your turn, if chosen
opponent has more cards in their hand than you, you
may draw cards until you have the same number."
SSK-085,"Royal Resolution: When you play this character,
you may pay 2{i} to choose one:
• Each opponent chooses and discards a card.
• Chosen character gets +2{s} this turn.
• Banish chosen damaged character."
SSK-086,"Butterfingers: When you play this character,
you may pay 2{i}  to banish chosen item."
SSK-087,"Here Kitty, Kitty, Kitty: When you play this
character, you may exert chosen damaged
character."
SSK-088,"Shift 3 (You may pay 3{i} to play this on top of
one of your characters named Robin Hood.)
Clever Plan: This character gets +1{l} for each
opposing damaged character in play."
SSK-089,"Mother Knows Best: When you play this
character, you may pay 3{i} to return chosen
character to their player's hand."
SSK-090,"One Step Behind: When you play this character,
if an opponent has more cards in their hand than
you, you may draw a card."
SSK-091,"Stick Around For Dinner: This character gets +1{s}
for each other Hyena character you have in play.
What Have We Got Here: Whenever one of your
Hyena characters challenges a damaged character,
gain 2 lore."
SSK-092,"Shift 4 (You may pay 4{i} to play this on top of
one of your characters named Mother Gothel.)
The World Is Dark: When you play this
character, each opponent chooses one of their
characters and returns that card to their hand."
SSK-093,"Ward (Opponents can't choose this character
except to challenge.)
Life's not fair, is it?: Whenever one of your
characters challenges a damaged character, you
may draw a card."
SSK-103,NA
SSK-104,"Refreshing Break: Whenever you ready this character, gain 1 lore for each 1 damage on him."
SSK-105,"Royally Big Rewards: At the end of your turn, if you have any characters in play with 5{s} or more, gain 2 lore. If you have any in play with 10{s} or more, gain 5 lore instead."
SSK-106,"Rush (This character can challenge the turn they're played.)
Game Jump: This character also counts as being named King Candy for Shift."
SSK-107,"Shift 4 (You may pay 4{i} to play this on top of one of your characters named Donald Duck.) Humble Pie: When you play this character, if you used Shift to play him, each opponent loses 2 lore. Raging Duck: While an opponent has 10 or more lore, this character gets +6{s}"
SSK-108,NA
SSK-109,"Long Live the King - When you play this character, you may banish chosen character named Mufasa."
SSK-110,Rush (This character can challenge the turn they're played.)
SSK-111,Evasive (Only characters with Evasive can challenge this character.)
SSK-112,"Perfect Partners: While you have a character named Minnie Mouse in play, this character gets +2{s}."
SSK-113,"Nothing Can Stand in My Way: While this character has damage, he gets +2{s}."
SSK-114,"Showstopper: When you play this character, if you have a location in play, each opponent loses 1 lore."
SSK-115,NA
SSK-116,"Scram!: When you play this character, if you have another character named Pete in play, you may banish chosen opposing character."
SSK-117,"Shift 2 (You may pay 2{i} to play this on top of one of your characters named Taffyta Muttonfudge.)
New Roster: Once per turn, when this character moves to a location, gain 2 lore."
SSK-118,"My Greatest Performance: Whenever this character quests, look at the top 4 cards of your deck. You my reveal an action card with cost 6 or less and play it for free. Put the rest in your discard."
SSK-119,"A Man Among Men!: For each damaged character you have in play, you pay 2{i} less to play this character.
Rush (This character can challenge the turn they're played.)"
SSK-120,NA
SSK-121,Reckless (This character can't quest and must challenge each turn if able.)
SSK-122,"Plucky Play: Whenever this character challenges another character, each opponent loses 1 lore."
SSK-123,"Shift 4 (You may pay 4{i} to play this on top of one of your characters named Ratigan.) Evasive (Only characters with Evasive can challenge this character.) Delightfully Wicked: Your damaged characters get +2{s}."
SSK-124,"Rush (This character can challenge the turn they're played.)
Pixlexia: When you play this character, she gains Evasive until the start of your next turn. (Only characters with Evasive can challenge them.)"
SSK-125,"I Laugh in the Face of Danger: When you play this character, chosen character gets +2{s} this turn."
SSK-126,"Dance-Off: Whenever this character or one of your characters named Mickey Mouse challenges another character, gain 1 lore."
SSK-137,NA
SSK-138,NA
SSK-139,Ward (Opponents can't choose this character except to challenge.)
SSK-140,NA
SSK-141,"Taxes Never Fail Me: Whenever you play an item, this character gets +2{s} this turn."
SSK-142,Long Live the King!: Your characters named Arthur gain Resist +1
SSK-143,"Helpful Supplies: At the start of your turn, if you have an item in play, gain 1 lore.
Perfect Directions: At the start of your turn, if you have a location in play, gain 1 lore."
SSK-144,"Shift 3 (You may pay 3{i} to play this on top of one of your characters named The Queen.)
Ward (Opponents can't choose this character except to challenge.)
Reflections of Vanity: For each other character named The Queen you have in play, this character gets +1{l}."
SSK-145,"Every Little Bit Helps: For each item you have in play, you pay 1{i} less to play this character.
Support (Whenever this character quests, you may add their {s} to another chosen character's {s} this turn.)"
SSK-146,"Support (Whenever this character quests, you may add their {s} to another chosen character's {s} this turn.)
One on the Way: During your turn, when you put a card into your inkwell, if it's the second card you've put into your inkwell this turn, you may draw a card."
SSK-147,"Beautiful, Lovely Taxes: {e} - Play an item from your hand or discard with cost 5 or less for free, exerted."
SSK-148,"Ward (Opponents can't choose this character except to challenge.)
Gatherer of the Wicked: When you play this character, look at the top 3 cards of your deck. You may reveal any number of character cards named The Queen and put them into your hand. Put the rest on the bottom of your deck in any order."
SSK-149,"Outplacement: When you play this character, you may put chosen item or location into its player's inkwell facedown and exerted.
By Invite Only: 4{i} - Your other characters gain Resist +1 until the start of your next turn. (Damage dealt to them is reduced by 1.)"
SSK-150,"A Delicate Balance: When you play this character, Exert all cards in your inkwell, then return 2 cards at random from your inkwell to your hand.
Everything the Light Touches: Whenever this character quests, ready all cards in your inkwell."
SSK-151,NA
SSK-152,"Cake Catapult - When you play this character, chosen character gets -2{s} this turn."
SSK-153,"Support (Whenever this character quests, you may add their {s} to another chosen character's {s} this turn.)"
SSK-154,"Shift 3 (You may pay 3{i} to play this on top of one of your characters named King Candy.)
Changing the Code: When you play this character, you may draw 2 cards, then put a card from your hand on the bottom of your deck."
SSK-155,"Baffling Mystery: When you play this character, you may put the top card of your deck into your inkwell facedown and exerted."
SSK-156,"Your Brothers Need Guidance: When you play this character, you may remove up to 1 damage from chosen character or location."
SSK-157,"Measure Me Again: When you play this character, you may put a card from your hand into your inkwell facedown and exerted."
SSK-158,"Ward (Opponents can't choose this character except to challenge.)
Ushered into the Party: When you play this character, your other characters gain Ward until the start of your next turn."
SSK-159,"Shift 5 (You may pay 5{i} to play this on top of one of your characters named Merlin.)
Overdeveloped Brain: When you play this character, if you used Shift to play him, you may search your deck for any card, put that card into your hand, then shuffle your deck."
SSK-171,"Heave Ho!: When you play this character, you may deal 2 damage to chosen character."
SSK-172,"Challenger +7 (While challenging, this character gets +7{s}.)
Intimidating Gaze: Opposing characters with cost 4 or less can't challenge."
SSK-173,"Face the Past: During your turn, whenever this character banishes another character in a challenge, you may draw a card."
SSK-174,NA
SSK-175,NA
SSK-176,Resist +1 (Damage dealt to this character is reduced by 1.)
SSK-177,Bodyguard (This character may enter play exerted. An opposing character who challenges one of your characters must choose one with Bodyguard if able.)
SSK-178,"Challenger +1 (While challenging, this character gets +1{s}.)"
SSK-179,Bodyguard (This character may enter play exerted. An opposing character who challenges one of your characters must choose one with Bodyguard if able.)
SSK-180,"Headwind: When you play this character, chosen knight character gains Challenger +2 this turn. (They get +2{s} when challenging.)"
SSK-181,"Stronger Together: When you play this character, if you have another Knight character in play, you may deal 1 damage to chosen character or location."
SSK-182,"I Don't Have Any Other Choice: For each opposing character banished in a challenge this turn, you pay 2{i} less to play this character.
Resist +3 (Damage dealt to this character is reduced by 3.)"
SSK-183,Natural Leader: This character gains Resist +1 for each other Knight character you have in play. (Damage dealt to this character is reduced by 1 for each other Knight.)
SSK-184,"I'm Warning You!: During your turn, whenever one of your characters banishes a character in a challenge, you may deal 1 damage to chosen character."
SSK-185,"Shift 5 (You may pay 5{i} to play this on top of one of your characters named Kronk.)
Are You on the List?: During your turn, whenever this character banishes another character in a challenge, you may play a character with cost 5 or less for free."
SSK-186,"Boon of Resilience: While one of your Knight characters is at a location, that character gains Resist +2. (Damage dealt to them is reduced by 2.)
Burst of Speed: During your turn, this character gains Evasive. (They can challenge characters with Evasive.)"
SSK-187,"Re-Pete: {e} - Reveal the top card of your deck. If it's a character card named Pete, you may play it for free."
SSK-188,NA
SSK-189,"Impress the Princess: While you have a character named Snow White in play, this character gains Bodyguard. (An opposing character who challenges one of your characters must choose one with Bodyguard if able.)"
SSK-190,NA
SSK-191,"Burst of Speed: During your turn, this character gains Evasive. (They can challenge characters with Evasive.)"
SSK-192,"Shift 4 (You may pay 4{i} to play this on top of one of your characters named Simba.)
Fearsome Roar: When you play this character, you may banish chosen item or location."
SSK-193,"Drastic Measures: When you play this character, you may discard your hand to draw 2 cards."
SSK-194,"Shift 5 (You may pay 5{i} to play this on top of one of your characters named Arthur.) Knighted by the King: When you play this character, chosen character gains Challenger +2 and Resist +2 and can challenge ready characters this turn. (They get +2{s} while challenging. Damage dealt to them is reduced by 2.)"
SSK-195,"Blow the Whistle: When you play this character, opponents can't play actions until the start of your next turn."
TFC-001,Voiceless - This character can't {e} to sing songs.
TFC-002,"Singer 5 (This character counts as cost 5 to sing songs.) 

Musical Debut - When you play this character, look at the top 4 cards of your deck. You may reveal a song card and put it into your hand. Put the rest on the bottom of your deck in any order."
TFC-003,"Singer 5 (This character counts as cost 5 to sing songs.) 

A Wonderful Dream - {e} - Remove up to 3 damage from chosen Princess character."
TFC-004,"Bodyguard (This character may enter play exerted. An opposing character who challenges one of your characters must choose one with Bodyguard if able.)

And Two For Tea! - When you play this character, you may remove up to 2 damage from each of your Musketeer characters."
TFC-005,"Shift 6 (You may pay 6 {i} to play this on top of one of your characters named Hades.) 

Sinister Plot - This character gets +1 {l} for each other Villain character you have in play."
TFC-006,"Well of Souls - When you play this character, return a character card from your discard to your hand."
TFC-007,"Support (Whenever this character quests, you may add their {s} to another chosen character's {s} this turn.)"
TFC-008,"Loyal - If you have a character named Gaston in play, you pay 1 {i} less to play this character."
TFC-009,NA
