Unique_ID,Body_Text
INK-059,"You're Too Late - Whenever this character quests, chosen opposing character can't ready at the start of their next turn."
INK-069,"The Bear - Whenever this character moves to a location, he gets +3{s} this turn."
INK-070,"Poor Souls - Whenever this character is challenged, each opponent chooses and discards a card."
INK-071,Evasive (Only characters with Evasive can challenge this character.)
INK-072,Eerie Pair - Your characters named Jetsam get +3{s}.
INK-073,"You Thieving Scoundrel - When you play this character, the player or players with the most cards in their hand chooses and discards a card."
INK-074,"Shift 3 (You may pay 3{i} to play this on top of one of your characters named Helga Sinclair.)

This Changes Everything - Whenever this character quests, you may deal 3 damage to chosen damaged character."
INK-075,"Nothing Personal - When this character is challenged and banished, banish the challenging character."
INK-076,"Ward (Opponents can't choose this character except to challenge.)

Eerie Pair - Your characters named Flotsam gain Ward."
INK-077,"Skysurfing - When you play this character, you may return chosen opposing character with 2{s} or less to their player's hand."
INK-078,"Well, Now You Know - When you play this character, chosen opposing character gains Reckless during their next turn. (They can't quest and must challenge if able.)

Thanks For Volunteering - Whenever one of your other characters is banished, each opponent loses 1 lore."
INK-079,NA
INK-080,"Shift 4 (You may pay 4{i} to play this on top of one of your characters named Milo Thatch.)

Take Them By Surprise - When this character is banished, return all opposing characters to their player's hands."
INK-081,Mimicry - You may play any character with Shift on this character as if this character had any name.
INK-082,"I Came To Listen To The Stories - Once per turn, when this character moves to a location, gain lore equal to that location's {l}."
INK-083,"Collect Taxes - Whenever this character quests, each opponent with more lore than you loses 2 lore."
INK-084,NA
INK-085,"I'll Handle This - While this character is at a location, she gets +3{s}. What's The Hurry? - While this character is at a location, whenever she challenges another character, you may draw a card."
INK-086,Evasive (Only characters with Evasive can challenge this character.)
INK-087,Ward (Opponents can't choose this character except to challenge.)
INK-088,NA
INK-089,"Evasive (Only characters with Evasive can challenge this character.)

Hide - While this character is at a location, he gains Ward. (Opponents can't choose them except to challenge.)"
INK-090,"You'll Never Even Miss It - When you play this character, chosen opponent reveals their hand and discards a song card of your choice."
INK-091,"What A Deal - Whenever this character sings a song, you may play that song again from your discard for free, then put it on the bottom of your deck."
INK-092,"Evasive (Only characters with Evasive can challenge this character.)

Disassemble - {e}: Banish chosen item."
INK-093,"It's Time To Go! - While this character is at a location, he gets +1{l}."
INK-103,"Evasive (Only characters with Evasive can challenge this character.)

Inspiring Voice - Whenever you play a song, chosen character of yours gains Evasive until the start of your next turn."
INK-104,NA
INK-105,"Nemesis - During your turn, whenever this character banishes another character in a challenge, ready this character. He can't quest for the rest of this turn.

Man-To-Man - Characters named Peter Pan lose Evasive and can't gain Evasive."
INK-106,Reckless (This character can't quest and must challenge each turn if able.)
INK-107,"Mindless Wandering - Once per turn, when this character moves to a location, each opponent loses 1 lore."
INK-108,"Watch The Teeth - Whenever this character is dealt damage, deal that much damage to chosen opposing character."
INK-109,"This Is It! - When you play this character, you may play a location with cost 4 or less for free.

Take The Helm - Whenever you play a location, this character may move there for free."
INK-110,NA
INK-111,"Plunder - When you play this character, each opponent loses 1 lore."
INK-112,"That Terrible Woman - When you play this character, banish chosen opposing character with 3{s} or less."
INK-113,"Reckless (This character can't quest and must challenge each turn if able.)

In Ma Belly - Whenever a character of yours named HeiHei quests, this character gets +1{l} and loses Reckless this turn."
INK-114,"This Mission Is Cursed - This character can't ready at the start of your turn.

I Got Your Back - 2{i}: Ready this character. He can't quest for the rest of the turn."
INK-115,"I'm Your Man! - While this character is at a location, he gets +2{s}."
INK-116,"Shift 3 (You may pay 3{i} to play this on top of one of your characters named Moana.)

Welcome To My Boat - Whenever this character quests while at a location, ready all other characters here, they can't quest for the rest of this turn."
INK-117,Evasive (Only characters with Evasive can challenge this character.)
INK-118,NA
INK-119,"Rush (This character can challenge the turn they're played.)  Over Here, Tink - While you have a character named Tinker Bell in play, this character gets +2{s}."
INK-120,"Shift 4 (You may pay 4{i} to play this on top of one of your characters named Peter Pan.)

Evasive (Only characters with Evasive can challenge this character.)

You're Next! - Whenever he challenges a Pirate character, this character takes no damage from the challenge."
INK-121,"Surprise Maneuver - When this character is banished, you may banish chosen character."
INK-122,"Brute - While this character has damage, he gets +3{s}."
INK-123,NA
INK-124,"The Fox - If you have a character named Peter Pan in play, you pay 1{i} less to play this character.

Evasive (Only characters with Evasive can challenge this character.)"
INK-125,Rush (This character can challenge the turn they're played.)
INK-126,Old Betsy - Your characters named Nutsy get +1{l}.
INK-127,NA
INK-137,"Ward (Opponents can't choose this character except to challenge.)

Spare Parts - Whenever this character quests, ready one of your items."
INK-138,"Discipline - During your turn, this character gains Evasive. (They can challenge characters with Evasive.)"
INK-139,"Support (Whenever this character quests, you may add their {s} to another chosen character's {s} this turn.)"
INK-140,"They'll Never See It Coming! - During your turn, this character gains Evasive. (They can challenge characters with Evasive."
INK-141,NA
INK-142,"There Was Only Ocean - When you play this character, look at the top 2 cards of your deck. You may put one into your hand. Put the rest on the bottom of your deck in any order."
INK-143,"Shift 5 (You may pay 5{i} to play this on top of one of your characters named Gramma Tala.)

Do You Know Who You Are? - Whenever a card is put into your inkwell, gain 1 lore."
INK-144,Now Try To Keep Up - {e}: Put an item card from your discard on the top of your deck.
INK-145,"Support (Whenever this character quests, you may add their {s} to another chosen character's {s} this turn.)

Three Nephews - Whenever this character quests, if you have characters named Dewey and Louie in play, you may draw 3 cards."
INK-146,NA
INK-147,"Shift 3 (You may pay 3{i} to play this on top of one of your characters named Kit Cloudkicker.)

Ward (Opponents can't choose this character except to challenge.)"
INK-148,Ward (Opponents can't choose this character except to challenge.)
INK-149,"Support (Whenever this character quests, you may add their {s} to another chosen character's {s} this turn.)"
INK-150,"Highborn Lady - When you play this character, chosen character gets -2{s} this turn."
INK-151,"This Going To Be Good - Whenever you play a song, you may put the top card of your deck into your inkwell facedown and exerted."
INK-152,NA
INK-153,"Too Old To Be Chasing Mice - When this character is banished, you may put this card into your inkwell facedown and exerted."
INK-154,"I'm Going Home! - During your turn, this character gains Evasive. (They can challenge characters with Evasive.)

I Didn't Get Rich By Being Stupid - During your turn, whenever this character banishes another character in a challenge, you may play an item for free."
INK-155,"Treasure Rigger - Whenever this character quests, you pay 1{i} less for the next item you play this turn."
INK-156,"Calculating And Vain - Whenever this character quests, you may look at the top 3 cards of your deck and put them back in any order."
INK-157,"I Can Use That - Whenever one of your items is banished, you may put that card into your inkwell facedown and exerted."
INK-158,"Ward (Opponents can't choose this character except to challenge.)

Support (Whenever this character quests, you may add their {s} to another chosen character's {s} this turn.)"
INK-171,NA
INK-172,Resist +1 (Damage dealt to this character is reduced by 1.)
INK-173,"All Tied Up - This character enters play exerted and can't ready at the start of your turn.

Break Free - During your turn, whenever one of your other characters banished another character in a challenge, you may ready this character."
INK-174,Call The Titans - {e}: Ready your Titan characters.
INK-175,"Challenger +2 (While challenging, this character gets +2{s}.)"
INK-176,"Chart Your Own Course - For each location you have in play, this character gains Resist +1 and gets +1{l}. (Damage dealt to them is reduced by 1.)"
INK-177,Bodyguard (This character may enter play exerted. An opposing character who challenges one of your characters must choose one with Bodyguard if able.)
INK-178,"Shift 4 (You may pay 4{i} to play this on top of one of your characters named Little John.)

Okay, Big Shot - While this character is exerted, your characters with Bodyguard gain Resist +1 and get +1{l}."
INK-179,"Bodyguard (This character may enter play exerted. An opposing character who challenges one of your characters must choose one with Bodyguard if able.)

Disguised - During your turn, this character gains Evasive. (They can challenge characters with Evasive.)"
INK-180,"Resist +2 (Damage dealt to this character is reduced by 2.)

Stone Skin - {e}: Chosen character gains Resist +2 this turn."
INK-181,Let's Take A Look - This character gets +1{s} for each location you have in play.
INK-182,"Sound The Call - {e}, 2{i}: Play a character for free."
INK-183,"Journey - While this character is at a location, she gets +2{s}."
INK-184,"Oh Dear, Dear, Dear - At the end of your turn, if this character is exerted and you don't have a Captain character in play, deal 1 damage to this character."
INK-185,NA
INK-186,NA
INK-187,"Eruption - During your turn, whenever this character banishes another character in a challenge, you may ready chosen character."
INK-188,"Looky Here - While this character has no damage, he gets +2{s}."
INK-189,NA
INK-190,"Shift 3 (You may pay 3{i} to play this on top of one of your characters named Robin Hood.)

Skilled Combatant - During your turn, whenever this character banishes another character in a challenge, gain 2 lore.

The Good Of Others - When this character is banished in a challenge, you may draw a card."
INK-191,"Taxes Should Hurt - Whenever you discard a card, you may deal 1 damage to chosen opposing character."
INK-192,"Step Down Or Fight - When you play this character and whenever he banishes another character in a challenge during your turn, you may choose one: - Draw 2 cards, then choose and discard 2 cards. - Deal 2 damage to chosen character."
INK-193,"Triumphant Stance - During your turn, whenever this character banishes another character in a challenge, chosen opposing character can't challenge during their next turn."
INK-194,"My Teeth Are Sharper - Whenever this character quests while at a location, you may deal 1 damage to chosen character."
ROF-001,"Oh, Gosh! - This character can't quest unless you have another Seven Dwarfs character in play."
ROF-002,"We'll Always Be Together: Whenever you ready this character, if you have 2 or more other characters in play, gain 2 lore."
ROF-003,Singer 3 (This character counts as cost 3 to sing songs.)
ROF-004,NA
ROF-005,"Share and Share Alike: Whenever this character quests, you pay 1 {i} less for the next character you play this turn."
ROF-006,"Odd One Out: When this character is banished, your other Seven Dwarfs characters get +2 {s} until the start of your next turn."
ROF-007,NA
ROF-008,Singer 5 ( This character counts as cost 5 to sing songs.)
ROF-009,"Yes, Your Majesty - Your Prince, Princess, King, and Queen characters get +1 {s}."
ROF-010,There's Trouble A-Brewin' - Your other Seven Dwarfs characters get +1 {s}.
ROF-011,"Support (Whenever this character quests, you may add their {s} to another chosen character's {s} this turn.)"
ROF-012,"Lay It On The Line - Whenever another character is banished, you may remove up to 2 damage from this character."
ROF-013,"Glad You're Here! - Whenever this character quests, you pay 3 {i} less for the next character you play this turn."
ROF-014,"The Sun Will Set - When this character is banished, you may reveal the top card of your deck. If it's a character card, you may play that character for free and they enter play exerted. Otherwise, put it on the top of your deck."
ROF-015,"Support (Whenever this character quests, you may add their {s} to another chosen character's {s} this turn.)"
ROF-016,"Shift 2 (You may pay 2 {i} to play this on top of one of your characters named Mulan.)

Honor To The Ancestors - Whenever this character quests, you may reveal the top card of your deck. If it's a song card, you may play it for free. Otherwise, put it on the top of your deck."
ROF-017,"Nursemaid - Whenever you play a Floodborn character, you may remove all damage from chosen character."
ROF-018,NA
ROF-019,"Shift 3 (You may pay 3 {i} to play this on top of one of your characters named Rapunzel.)

Let Your Power Shine - Whenever you remove 1 or more damage from one of your characters, you may draw a card."
ROF-020,Magic Hair - {e}: Remove up to 2 damage from chosen character.
ROF-021,Yawn! - This character enters play exerted.
ROF-022,"Ah-Choo! Whenever you play this character or another Seven Dwarfs character, you may give chosen character -1 {s} this turn."
ROF-023,"I Won't Hurt You - When you play this character, you may remove up to 2 damage from chosen character."
ROF-024,How Do You Do? - You pay 1 {i} less to play Seven Dwarfs Characters.
ROF-025,"Shift 4 (You may pay 4 {i} to play this on top of one of your characters named Snow White.)

Wishes Come True - Whenever this character quests, you may return a character card from your discard to your hand."
ROF-026,"Shift 2 (You may pay 2 {i} to play this on top of one of your characters named The Queen.)

Who is the Fairest? - Whenever this character quests, chosen opposing character gets -4 {s} this turn and chosen character gets +4 {s} this turn."
ROF-027,NA
ROF-035,"Student: Whenever this character quests, you may return another chosen character of yours to your hand to gain 2 lore."
ROF-036,"Evasive (Only characters with Evasive can challenge this character.)
Ethereal Glow: Whenever you play a Floodborn character, you may draw a card."
ROF-037,NA
ROF-038,Evasive (Only characters with Evasive can challenge this character.)
ROF-039,"Challenger +3 (While challenging, this character gets +3 {s}.)"
ROF-040,NA
ROF-041,"Shift 2 (You may pay 2 {i} to play this on top of one of your characters named Fairy Godmother.)
Forget The Coach, Here's A Sword: Whenever this character quests, your characters gain Challenger +3 and ""When this character is banished in a challenge, return this card to your hand"" this turn. (They get +3 {s} while challenging.)"
ROF-042,"Just Leave It To Me: Whenever you play a character named Cinderella, you may exert chosen character."
ROF-043,"He's Back: When this character is banished in a challenge, return this card to your hand."
ROF-044,"Evasive (Only characters with Evasive can challenge this character.)
That Still, Small Voice: When you play this character, if you have a character named Pinocchio in play, you may draw a card."
ROF-045,"Ok, Where am I?: When this character is banished, you may draw a card."
ROF-046,"Chasing The Rabbit: When you play this character, banish her or return another chosen character of yours to your hand.
Rush (This character can challenge the turn they're played.)"
ROF-047,"Evasive (Only characters with Evasive can challenge this character.)\nI Win, I Win!: When you play this character, banish her or return another 2 chosen characters of yours to your hand."
ROF-048,"Shift 3 (You may play 3 {i} to play this on top of one of your characters named Madam Mim.)
Gruesome And Grim: {e} - Play a character with cost 4 or less for free. They gain Rush. At the end of the turn, banish them. (They can challenge the turn they're played)"
ROF-049,"Just You Wait: When you play this character, banish her or return another chosen character of yours to your hand."
ROF-050,"Ready Or Not!: When you play this character and when he leaves play, chosen characters gain Challenger +3 this turn. (They get +3 {s} while challenging.)"
ROF-051,"Here I Come!: When you play this character and when he leaves play, gain 1 lore."
ROF-052,"Hoppity Hip!: When you play this character and when he leaves play, you may draw a card."
ROF-053,"Battle Of Wits: Whenever one of your other characters is returned to your hand from play, this characters get +1 {l} this turn."
ROF-054,"Look Before You Leap: When you play this character and when he leaves play, look at the top card of your deck. Put it on either the top or the bottom of your deck."
ROF-055,"Evasive (Only characters with Evasive can challenge this character.)
Rush (This character can challenge the turn they're played.)
Tiptoe: Your other characters with Rush gain Evasive."
ROF-056,NA
ROF-057,"Shift 3 (You pay 3 {i} to play this on top of one of your characters named Pinocchio.)
Listen To Your Conscience: When you play this character, you may return chosen character or item with cost 3 or less to their player's hand."
ROF-058,"Telling Lies: When you play this character, you may exert chosen opposing character."
ROF-059,NA
ROF-060,"Shift 4 (You may pay 4 {i} to play this on top of one of your characters named Yzma)
Cruel Irony: When you play this character, shuffle another chosen character card into their player's deck. That player draws 2 cards."
ROF-061,NA
ROF-069,NA
ROF-070,"Second Wind: Whenever an opposing character is damaged, you may ready this character."
ROF-071,"Use Your Imagination: While an opponent has no cards in their hand, this character gets +2 {l}."
ROF-072,"Shift 3 (You may pay 3 {i} to play this on top of one of your characters named Belle.)
Thorny Arrows: Whenever this character is challenged, the challenging character's player discards all cards in their hand."
ROF-073,"Ward (Opponents can't choose this character except to challenge.)
Squeak: Whenever you play a Floodborn character, each opponent chooses and discards a card."
ROF-074,NA
ROF-075,"Shift 5 (You may pay 5 {i} to play this on top of one of your characters named Cheshire Cat.)
Evasive (Only characters with Evasive can challenge this character.)
Wicked Smile: {e} - Banish chosen damaged character."
ROF-076,"Thwart: Whenever this character quests, each opponent chooses and discards a card."
ROF-077,"Shift 3 (You may pay 3 {i} to play this on top of one of your characters named Donald Duck.)
Allow Me: At the start of your turn, each player may draw a card."
ROF-078,"Startled Awake: Whenever you play an action, this character gets +2 {s} this turn."
ROF-079,"Evasive (Only characters with Evasive can challenge this character.)
You're In My World: Whenever this character quests, chosen opposing character can't quest during their next turn."
ROF-080,"True Form: While being challenged, this character gets +2 {s}."
ROF-081,NA
ROF-082,"Shift 2 (You may 2 {i} to play this on top of one of your characters named Flynn Rider.)
Evasive (Only characters with Evasive can challenge this character.)
One Last, Big Score: This character gets -1 {l} for each card in your opponents' hands."
ROF-083,"Yes, I'm Intimidating: While one or more opponents have no cards in their hands, this character gets +3 {s}."
ROF-084,NA
ROF-085,"Mouse Catcher: When you play this character, each opponent chooses and discards either 2 cards or 1 action card."
ROF-086,"Coming, Your Most Lugubriousness: While this character has 5 {s} or more, he gets +2 {l}."
ROF-087,"I Can Handle It: When you play this character, chosen character gets +2 {s} this turn. If the chosen character is named Pain, he gets +4 {s} instead."
ROF-088,"Ward (Opponents can't choose this character except to challenge.)
Take That!: Whenever you play an action, this character gets +2 {s} this turn.
Who's Next?: While this character has 7 {s} or more, he gets +2 {l}."
ROF-089,"Ward (Opponents can't choose this character except to challenge.)
I Sentence You: Whenever your opponents discards 1 or more cards, you may draw a card for each card discarded."
ROF-090,"Royal Rage: When you play this character, deal 1 damage to chosen damaged opposing character."
ROF-091,Evasive (Only characters with Evasive can challenge this character.)
ROF-092,Evasive (Only characters with Evasive can challenge this character.)
ROF-093,"A Perfect Disguise: {e}, Choose and discard a character card - Gain lore equal to the discarded character's {l}."
ROF-094,NA
ROF-095,NA
ROF-103,NA
ROF-104,NA
ROF-105,NA
ROF-106,"Evasive (Only characters with Evasive can challenge this character.)  Phooey!: This character gets +1 {l} for each 1 damage on him."
ROF-107,Reckless (This character can't quest and must challenge each turn if able.)
ROF-108,"Evasive (Only characters with Evasive can challenge this character.)
"
ROF-109,"Easy Street - Whenever you play a Floodborn character, each opponent loses 1 lore."
ROF-110,"Shift 4 (You may pay 4 {i} to play this on top of one of your characters named Lady Tremaine.)

Power To Rule At Last - When you play this character, each opponent chooses and banishes one of their characters."
ROF-111,"Not For You - When you play this character, each opponent with more lore than you loses 1 lore."
ROF-112,NA
ROF-113,Evasive (Only characters with Evasive can challenge this character.)
ROF-114,"Shift 2 (You may pay 2 {i} to play this on top of one of your characters named Minnie Mouse.)
Evasive (Only Characters with Evasive can challenge this character.)
Undersea Adventure: Whenever you play a second action in a turn, this character gets +2 {l} this turn."
ROF-115,NA
ROF-116,What Have You Done?!: This character enters play with 3 damage.
ROF-117,Rush (This character can challenge the turn they're played.)
ROF-118,"This Shouldn't Take Long: {e}, Banish this character - Banish chosen character."
ROF-119,Rush (This character can challenge the turn they're played.)
ROF-120,"Shift 2 (You may pay 2 {i} to play this on top of one of your characters named Queen of Hearts.)
Let The Game Being: Whenever one of your characters challenges another character, you may draw a card."
ROF-121,"This Is My Kingdom: When you play this character, exert chosen opposing character with 3 {s} or less. Choose one of your characters and read them. They can't quest for the rest of this turn."
ROF-122,"Note To Self, Don't Die: During your turn, whenever this character banishes another character in a challenge, you may ready this character. She can't quest for the rest of this turn."
ROF-123,"Shift 4 (You may pay 4 {i} to play this on top of one of your characters named Raya.)
Champion Of Kumandra: Whenever this character challenges a damaged character, she takes no damage from the challenge."
ROF-124,NA
ROF-125,"Rush (This character can challenge the turn they're played.)
Daddy Isn't Here To Save You: During your turn, whenever this character banishes another character in a challenge, you may ready this character. He can't quest for the rest of this turn."
ROF-126,"Don't Insult My Intelligence: Whenever one of your characters challenges another character, gain 1 lore."
ROF-127,"Energetic: Whenever you play an action, this character gets +2 {s} this turn."
ROF-128,Reckless (This character can't quest and must challenge each turn if able.)
ROF-137,"Good Advice - Your other characters gain Support. (Whenever they quest, you may add their {s} to another chosen character's {s} this turn.) What Did I Do? - While this character has 10 {s} or more, she gets +4 {l}."
ROF-138,"Shift 5 (You may pay 5 {i} to play this on top of one of your characters named Basil.)
There's Always A Chance: If you used Shift to play this character, you may draw 2 cards when he enters play."
ROF-139,"Support (Whenever this character quests, you may add their {s} to another chosen character's {s} this turn.)"
ROF-140,NA
ROF-141,NA
ROF-142,"Shift 3 (You may pay 3 {i} to play this on top of one of your characters named Cogsworth.)
Ward (Opponents can't choose this character except to challenge.)
Unwind: Your other characters gain Resist +1 (Damage dealt to them is reduced by 1)"
ROF-143,"Wait A Minute: Your characters with Reckless gain ""{e} - Gain 1 lore."""
ROF-144,"Now Get Going: During your turn, this character gains Evasive. (They can challenge characters with Evasive.)"
ROF-145,"Shift 3 (You may pay 3 {i} to play this on top of one of your characters named Cruella De Vil.)
Oh, No You Don't: Whenever this character quests, chosen opposing character gets -2 {s} this turn."
ROF-146,Ward (Opponents can't choose this character except to challenge.)
